{"commit":"25f8bc3966ffae940658be94161d31edd83492c9","created":"2026-10-01T09:01:05+00:00","device":{"adapter":"SraKmd_arden","commit":"25f8bc3966ffae940658be94161d31edd83492c9","hardware_gpu":true,"package":"GianlucaMazza.XgpuE0_0.1.0.28_x64__g0p5dcfz4t9z4","schema":"floppylm.device.v1","state":"ready"},"fixtures":[{"actual_sha256":"5b8410d48d394c736027f6aa51db9c68487e9c5fbccc63ef6f54cd0a88dc1147","ok":true,"path":"fixture-00"},{"actual_sha256":"a5b339b803f5eb668d8ae4ff833c5e1549e166ed4b798a2a27c878b181eac7d9","ok":true,"path":"fixture-01"},{"actual_sha256":"38d5b3827e57336b10f40d0abc3c983f98a93f75c4f38f32225d3e4ae8119e30","ok":true,"path":"fixture-02"},{"actual_sha256":"617e11f57d2b77d03880587eef8165380fad45a512629ee98349026344f640d4","ok":true,"path":"fixture-03"},{"actual_sha256":"f2ab4eec1387b707d85f4cef335a50946f7ba9e28534a9818861734920030a71","ok":true,"path":"fixture-04"},{"actual_sha256":"945f6e8d7f1f5581b27d6aa93e520c2609e7084f78de3e68b58031f7b2889387","ok":true,"path":"fixture-05"},{"actual_sha256":"c400c36395c0f13b928cfa8bfe0db7521bbe35b110a94851aa2d82df1a6a825c","ok":true,"path":"fixture-06"},{"actual_sha256":"5ca0cdfa7f0e7fbbb91fc94a6c53cddc8e40a04c9d827215bbb86af2fd40a5c0","ok":true,"path":"fixture-07"},{"actual_sha256":"0597ef4eabc152617f08b5058a48fe887ead7861cdbe24d4958652543082a383","ok":true,"path":"fixture-08"},{"actual_sha256":"c583eb939985f24281b2b663eec9d29e30674864b7940397c78a6a5c68104c83","ok":true,"path":"fixture-09"},{"actual_sha256":"1cdca71076deb5de2c36c5ea1309d11a125669b76fe3c7ccae8e531d3f296ac1","ok":true,"path":"fixture-10"},{"actual_sha256":"c628a5e3ad0348068b5126828e432b0d3a7920549e54e2c9e1270944ac4c1ac5","ok":true,"path":"fixture-11"},{"actual_sha256":"d2a0e85085c32e4181afcc5ddc42cc362677ff8364ca9abf6661e81736fac235","ok":true,"path":"fixture-12"},{"actual_sha256":"e72ffbd67028b823cf0739cca0d6f7b41537b613783e46f403d1e891ade60a5d","ok":true,"path":"fixture-13"},{"actual_sha256":"95a086fbc412b71eacf5bb9ea08213649d66892678ec81dd317756e34ac8375e","ok":true,"path":"fixture-14"},{"actual_sha256":"f4a859bdbe959c183489652ee6550544a9b94e6adaa2324316903a5beceb46e1","ok":true,"path":"fixture-15"},{"actual_sha256":"835219d1ceae268ea82e364557604995d446e644fdae5f6bdf5a7e5cda4722e3","ok":true,"path":"fixture-16"},{"actual_sha256":"c4853d757ec54c0f138b7b5a0b8590d730f5d84ab64a5ae96c414db625a4b61f","ok":true,"path":"fixture-17"},{"actual_sha256":"acaadc46666c05771d3b122fead1a3ce4120dde19e3037a83d86926d83fb7c9c","ok":true,"path":"fixture-18"},{"actual_sha256":"877d36161c6f471a01f2751f86e11a9547f07e7ec52dbcb1158d9a498b2de85c","ok":true,"path":"fixture-19"},{"actual_sha256":"aeb437ba3fd15babeb9693c8c18aab5961c6078f8dbe2a1c3642d09638ed2c9b","ok":true,"path":"fixture-20"},{"actual_sha256":"38883debfaf09cf2d3cb253a0ae866f83134550249f488128daceaae12184cad","ok":true,"path":"fixture-21"},{"actual_sha256":"c24d44792ad00c00bebc25d187f385a3a8dddb381c0fb86e11806d6aedaee722","ok":true,"path":"fixture-22"},{"actual_sha256":"3d16e5859810f173184b4e61aef296e025552b0b3d4609d558f300da9a040d90","ok":true,"path":"fixture-23"},{"actual_sha256":"150bb5ccd39099fe8958758a984adb92f5fb36efdbc210fb62d4f04d51ce3e47","ok":true,"path":"fixture-24"},{"actual_sha256":"9dcdb11d89705ffffd89fdfb7b3324d49164d9d99890c6bd51f432cb24d21e34","ok":true,"path":"fixture-25"},{"actual_sha256":"a3101f09cbefa6eef6340e26f0d805bdded9cfb0a74c41a4889f3166700cc02d","ok":true,"path":"fixture-26"},{"actual_sha256":"6b5eabc71bd19bebc92f4d4add28b9574eb5355ba5ea281b5b01a038cafbca57","ok":true,"path":"fixture-27"},{"actual_sha256":"f7bb558acf155aa237a0af012518817e6873f4ff89b3402d93c050636fb369f2","ok":true,"path":"fixture-28"},{"actual_sha256":"0d7fde673e22e139e7f80b340984e06f464e1393b88ec372c4f34fe2ac737c89","ok":true,"path":"fixture-29"},{"actual_sha256":"2c148730aae3f7c2913b6dd2f8c6ee39668f5018b523d5acf8fd93c6ebd8d723","ok":true,"path":"fixture-30"},{"actual_sha256":"4850e56831594f3a6a4005a507480a1bf91d592a8f69ad4a69d6539c9a9f6aaf","ok":true,"path":"fixture-31"},{"actual_sha256":"ad34a908374a595fb1bf07ef890e211f490398fee5cce2482b04a738f313a34e","ok":true,"path":"fixture-32"},{"actual_sha256":"091a47dfed414ca344e43cb711fe3ddf9923bba4b5d9336314d4b5f4d488d14b","ok":true,"path":"fixture-33"},{"actual_sha256":"ce78fa3b459b6dc82fcbf059e3b904f8cd2e089a94b6c890066c87d66aa8c74b","ok":true,"path":"fixture-34"},{"actual_sha256":"c6ff1e5f14ca73faf82c9e4d1481c8c572923897754ec6fba4ef85126bad4f21","ok":true,"path":"fixture-35"}],"kernels":{"case_count":52,"gates":{"activation-0:0":{"max_abs":4.76837158203125e-07,"max_bound_excess":0.0,"max_rel":2.6199683507823227e-06,"ok":true},"activation-0:1":{"max_abs":1.1920928955078125e-07,"max_bound_excess":0.0,"max_rel":2.203889129684183e-06,"ok":true},"activation-1:0":{"max_abs":0.0,"max_bound_excess":0.0,"max_rel":0.0,"ok":true},"activation-1:1":{"max_abs":0.0,"max_bound_excess":0.0,"max_rel":0.0,"ok":true},"activation-2:0":{"max_abs":9.5367431640625e-07,"max_bound_excess":0.0,"max_rel":4.084093110788377e-07,"ok":true},"activation-2:1":{"max_abs":5.960464477539062e-07,"max_bound_excess":0.0,"max_rel":4.2695259511180267e-07,"ok":true},"add:0":{"max_abs":0.0,"max_bound_excess":0.0,"max_rel":0.0,"ok":true},"add:1":{"max_abs":0.0,"max_bound_excess":0.0,"max_rel":0.0,"ok":true},"add:2":{"max_abs":0.0,"max_bound_excess":0.0,"max_rel":0.0,"ok":true},"attention-scores:0":{"max_abs":2.384185791015625e-07,"max_bound_excess":0.0,"max_rel":1.1899755507623341e-07,"ok":true},"attention-scores:1":{"max_abs":4.76837158203125e-07,"max_bound_excess":0.0,"max_rel":3.2150037005348717e-06,"ok":true},"attention-scores:2":{"max_abs":4.76837158203125e-07,"max_bound_excess":0.0,"max_rel":1.8923877315746406e-06,"ok":true},"causal-softmax:0":{"max_abs":5.960464477539063e-08,"max_bound_excess":0.0,"max_rel":1.4007236418478514e-07,"ok":true},"causal-softmax:1":{"max_abs":0.0,"max_bound_excess":0.0,"max_rel":0.0,"ok":true},"causal-weighted:0":{"max_abs":0.0,"max_bound_excess":0.0,"max_rel":0.0,"ok":true},"causal-weighted:1":{"max_abs":0.0,"max_bound_excess":0.0,"max_rel":0.0,"ok":true},"causal-weighted:2":{"max_abs":0.0,"max_bound_excess":0.0,"max_rel":0.0,"ok":true},"coverage":{"ok":true},"cross-entropy-shift:0":{"max_abs":0.0,"max_bound_excess":0.0,"max_rel":0.0,"ok":true},"cross-entropy-shift:1":{"max_abs":1.1641532182693481e-09,"max_bound_excess":0.0,"max_rel":0.0,"ok":true},"cross-entropy:0":{"max_abs":2.384185791015625e-07,"max_bound_excess":0.0,"max_rel":6.57113377159291e-08,"ok":true},"cross-entropy:1":{"max_abs":5.960464477539063e-08,"max_bound_excess":0.0,"max_rel":4.1158541604700195e-07,"ok":true},"embedding-repeat:0":{"max_abs":0.0,"max_bound_excess":0.0,"max_rel":0.0,"ok":true},"embedding-repeat:2":{"max_abs":0.0,"max_bound_excess":0.0,"max_rel":0.0,"ok":true},"hardware":{"ok":true},"heads-0:0":{"max_abs":0.0,"max_bound_excess":0.0,"max_rel":0.0,"ok":true},"heads-0:1":{"max_abs":0.0,"max_bound_excess":0.0,"max_rel":0.0,"ok":true},"heads-1:0":{"max_abs":0.0,"max_bound_excess":0.0,"max_rel":0.0,"ok":true},"heads-1:1":{"max_abs":0.0,"max_bound_excess":0.0,"max_rel":0.0,"ok":true},"heads-2:0":{"max_abs":0.0,"max_bound_excess":0.0,"max_rel":0.0,"ok":true},"heads-2:1":{"max_abs":0.0,"max_bound_excess":0.0,"max_rel":0.0,"ok":true},"linear-17-96-391:0":{"max_abs":5.7220458984375e-06,"max_bound_excess":0.0,"max_rel":7.911287999396637e-05,"ok":true},"linear-17-96-391:1":{"max_abs":3.814697265625e-05,"max_bound_excess":0.0,"max_rel":0.0004499609536348616,"ok":true},"linear-17-96-391:2":{"max_abs":2.86102294921875e-06,"max_bound_excess":0.0,"max_rel":3.450270562737922e-05,"ok":true},"linear-7-11-13:0":{"max_abs":9.5367431640625e-07,"max_bound_excess":0.0,"max_rel":1.6278913792732963e-06,"ok":true},"linear-7-11-13:1":{"max_abs":9.5367431640625e-07,"max_bound_excess":0.0,"max_rel":6.632355938547163e-06,"ok":true},"linear-7-11-13:2":{"max_abs":9.5367431640625e-07,"max_bound_excess":0.0,"max_rel":2.787096486493266e-06,"ok":true},"multiply:0":{"max_abs":0.0,"max_bound_excess":0.0,"max_rel":0.0,"ok":true},"multiply:1":{"max_abs":0.0,"max_bound_excess":0.0,"max_rel":0.0,"ok":true},"multiply:2":{"max_abs":0.0,"max_bound_excess":0.0,"max_rel":0.0,"ok":true},"rmsnorm-1.0:0":{"max_abs":2.384185791015625e-07,"max_bound_excess":0.0,"max_rel":2.1061668143089603e-07,"ok":true},"rmsnorm-1.0:1":{"max_abs":2.384185791015625e-07,"max_bound_excess":0.0,"max_rel":1.8021217232684645e-06,"ok":true},"rmsnorm-1.0:2":{"max_abs":5.960464477539062e-07,"max_bound_excess":0.0,"max_rel":1.2613113349424863e-06,"ok":true},"rmsnorm-1e-05:0":{"max_abs":0.0,"max_bound_excess":0.0,"max_rel":0.0,"ok":true},"rmsnorm-1e-05:1":{"max_abs":0.00048828125,"max_bound_excess":0.0,"max_rel":1.1691683752113856e-07,"ok":true},"rmsnorm-1e-05:2":{"max_abs":7.450580596923828e-09,"max_bound_excess":0.0,"max_rel":2.802753424964685e-07,"ok":true},"rope:0":{"max_abs":5.960464477539062e-07,"max_bound_excess":0.0,"max_rel":2.351239590306578e-06,"ok":true},"rope:1":{"max_abs":5.364418029785156e-07,"max_bound_excess":0.0,"max_rel":3.162176752128258e-05,"ok":true},"slice-0:0":{"max_abs":0.0,"max_bound_excess":0.0,"max_rel":0.0,"ok":true},"slice-0:1":{"max_abs":0.0,"max_bound_excess":0.0,"max_rel":0.0,"ok":true},"slice-1:0":{"max_abs":0.0,"max_bound_excess":0.0,"max_rel":0.0,"ok":true},"slice-1:1":{"max_abs":0.0,"max_bound_excess":0.0,"max_rel":0.0,"ok":true},"unheads:0":{"max_abs":0.0,"max_bound_excess":0.0,"max_rel":0.0,"ok":true},"unheads:1":{"max_abs":0.0,"max_bound_excess":0.0,"max_rel":0.0,"ok":true}},"hardware_gpu":true,"ok":true,"oracle":"independent PyTorch operations and autograd","purpose":"functional"},"ok":true,"optimizer":{"gates":{"1:first:blocks.0.fc.weight":{"max_abs":0.0,"max_bound_excess":0.0,"max_rel":0.0,"ok":true},"1:first:blocks.0.fc2.weight":{"max_abs":0.0,"max_bound_excess":0.0,"max_rel":0.0,"ok":true},"1:first:blocks.0.norm1.weight":{"max_abs":0.0,"max_bound_excess":0.0,"max_rel":0.0,"ok":true},"1:first:blocks.0.norm2.weight":{"max_abs":0.0,"max_bound_excess":0.0,"max_rel":0.0,"ok":tr